{"account_id":"892077329800","failure_reason":"QualificationError: qualification failed closed","gates":{"all_children_one_attempt":true,"all_children_succeeded":true,"array_size_exact":true,"child_indices_exact":true,"compute_environment_valid":true,"exact_teardown":false,"job_queue_valid":true,"no_provider_errors":true,"no_retries":true,"no_scientific_action":true,"preflight_exact":true},"identity_arn":"arn:aws:iam::892077329800:root","input_lock_sha256":null,"mutations":[{"duration_ms":1244,"operation":"create_service_linked_role","return_code":0,"stderr_sha256":"e3b0c44298fc1c149afbf4c8996fb92427ae41e4649b934ca495991b7852b855","stdout_sha256":"4066bec16577787be7154f53dfa322be238c2110ca14bb61819e4e6d189284dc","succeeded":true},{"duration_ms":1275,"operation":"create_execution_role","return_code":0,"stderr_sha256":"e3b0c44298fc1c149afbf4c8996fb92427ae41e4649b934ca495991b7852b855","stdout_sha256":"16fb8ce481bcadaf009b3a5752de10d18103c8351d24df53c282de28679b8864","succeeded":true},{"duration_ms":1210,"operation":"attach_execution_role_policy","return_code":0,"stderr_sha256":"e3b0c44298fc1c149afbf4c8996fb92427ae41e4649b934ca495991b7852b855","stdout_sha256":"e3b0c44298fc1c149afbf4c8996fb92427ae41e4649b934ca495991b7852b855","succeeded":true},{"duration_ms":1126,"operation":"create_compute_environment","return_code":0,"stderr_sha256":"e3b0c44298fc1c149afbf4c8996fb92427ae41e4649b934ca495991b7852b855","stdout_sha256":"92aabe18d516469075fc61c6457323b50ee64a912bb05366708bade7450d7ae6","succeeded":true},{"duration_ms":1131,"operation":"create_job_queue","return_code":0,"stderr_sha256":"e3b0c44298fc1c149afbf4c8996fb92427ae41e4649b934ca495991b7852b855","stdout_sha256":"af2d1bb4b604b86b4da81e5e4a5a52fde2ab9ca19ab9c4e4b595d98e07c3f630","succeeded":true},{"duration_ms":1269,"operation":"register_job_definition","return_code":0,"stderr_sha256":"e3b0c44298fc1c149afbf4c8996fb92427ae41e4649b934ca495991b7852b855","stdout_sha256":"7409a77bffc76dcfeff0f8e59bbcac639b22f346d4faa733f1b758d189c4d9fd","succeeded":true},{"duration_ms":1056,"operation":"submit_array_job","return_code":0,"stderr_sha256":"e3b0c44298fc1c149afbf4c8996fb92427ae41e4649b934ca495991b7852b855","stdout_sha256":"934e7b5e3ac252f9f281ab7d60f88a556de655360c0311668f45e853e139986b","succeeded":true},{"duration_ms":1117,"operation":"cancel_job","return_code":0,"stderr_sha256":"e3b0c44298fc1c149afbf4c8996fb92427ae41e4649b934ca495991b7852b855","stdout_sha256":"e3b0c44298fc1c149afbf4c8996fb92427ae41e4649b934ca495991b7852b855","succeeded":true},{"duration_ms":1167,"operation":"disable_job_queue","return_code":0,"stderr_sha256":"e3b0c44298fc1c149afbf4c8996fb92427ae41e4649b934ca495991b7852b855","stdout_sha256":"af2d1bb4b604b86b4da81e5e4a5a52fde2ab9ca19ab9c4e4b595d98e07c3f630","succeeded":true},{"duration_ms":1068,"operation":"delete_job_queue","return_code":0,"stderr_sha256":"e3b0c44298fc1c149afbf4c8996fb92427ae41e4649b934ca495991b7852b855","stdout_sha256":"e3b0c44298fc1c149afbf4c8996fb92427ae41e4649b934ca495991b7852b855","succeeded":true},{"duration_ms":1251,"operation":"disable_compute_environment","return_code":0,"stderr_sha256":"e3b0c44298fc1c149afbf4c8996fb92427ae41e4649b934ca495991b7852b855","stdout_sha256":"92aabe18d516469075fc61c6457323b50ee64a912bb05366708bade7450d7ae6","succeeded":true},{"duration_ms":1191,"operation":"delete_compute_environment","return_code":0,"stderr_sha256":"e3b0c44298fc1c149afbf4c8996fb92427ae41e4649b934ca495991b7852b855","stdout_sha256":"e3b0c44298fc1c149afbf4c8996fb92427ae41e4649b934ca495991b7852b855","succeeded":true},{"duration_ms":1148,"operation":"deregister_job_definition","return_code":0,"stderr_sha256":"e3b0c44298fc1c149afbf4c8996fb92427ae41e4649b934ca495991b7852b855","stdout_sha256":"e3b0c44298fc1c149afbf4c8996fb92427ae41e4649b934ca495991b7852b855","succeeded":true},{"duration_ms":1186,"operation":"detach_execution_role_policy","return_code":0,"stderr_sha256":"e3b0c44298fc1c149afbf4c8996fb92427ae41e4649b934ca495991b7852b855","stdout_sha256":"e3b0c44298fc1c149afbf4c8996fb92427ae41e4649b934ca495991b7852b855","succeeded":true},{"duration_ms":1141,"operation":"delete_execution_role","return_code":0,"stderr_sha256":"e3b0c44298fc1c149afbf4c8996fb92427ae41e4649b934ca495991b7852b855","stdout_sha256":"e3b0c44298fc1c149afbf4c8996fb92427ae41e4649b934ca495991b7852b855","succeeded":true},{"duration_ms":1217,"operation":"delete_service_linked_role","return_code":0,"stderr_sha256":"e3b0c44298fc1c149afbf4c8996fb92427ae41e4649b934ca495991b7852b855","stdout_sha256":"1a9ba4d9e0be97506fdcad4d0db8dd39233edfbf564f987ce470b534265c9739","succeeded":true}],"no_scientific_action":true,"observations":{"array_size":3,"child_indices":[0,1,2],"children":[{"attempt_count":1,"index":0,"job_id":"9c9e8830-f676-4d6d-97a5-f3d80085bb11:0","status":"SUCCEEDED"},{"attempt_count":1,"index":1,"job_id":"9c9e8830-f676-4d6d-97a5-f3d80085bb11:1","status":"SUCCEEDED"},{"attempt_count":1,"index":2,"job_id":"9c9e8830-f676-4d6d-97a5-f3d80085bb11:2","status":"SUCCEEDED"}],"compute_environment_status":"VALID","job_queue_status":"VALID","parent_status":"PENDING"},"plan_sha256":"24a23a86c2c488926e323c5b2d670fd985727d852b5160903153538b7d6c649a","preflight":{"account_exact":true,"compute_environment_absent":true,"execution_role_absent":true,"job_definition_absent":true,"job_queue_absent":true,"security_group_exact":true,"service_linked_role_absent":true,"subnet_exact":true,"vpc_exact":true},"provider":"aws","qualification_id":"batch-array-qualification-012","record_kind":"cloud_batch_array_qualification_receipt","region":"us-east-1","residual_resource_ids":[],"resources":{"child_job_ids":["9c9e8830-f676-4d6d-97a5-f3d80085bb11:0","9c9e8830-f676-4d6d-97a5-f3d80085bb11:1","9c9e8830-f676-4d6d-97a5-f3d80085bb11:2"],"compute_environment_arn":"arn:aws:batch:us-east-1:892077329800:compute-environment/pneuma-batch-array-012-ce","compute_environment_name":"pneuma-batch-array-012-ce","execution_role_arn":"arn:aws:iam::892077329800:role/pneuma-batch-array-exec-012","job_definition_arn":"arn:aws:batch:us-east-1:892077329800:job-definition/pneuma-batch-array-012-jd:1","job_definition_revision":1,"job_queue_arn":"arn:aws:batch:us-east-1:892077329800:job-queue/pneuma-batch-array-012-q","job_queue_name":"pneuma-batch-array-012-q","parent_job_id":"9c9e8830-f676-4d6d-97a5-f3d80085bb11","service_linked_role_arn":"arn:aws:iam::892077329800:role/aws-service-role/batch.amazonaws.com/AWSServiceRoleForBatch"},"schema_version":"0.1.0","teardown":{"compute_environment_deleted":true,"compute_environment_disabled":true,"execution_policy_detached":true,"execution_role_deleted":true,"final_resources_absent":false,"job_cancelled_if_needed":true,"job_definition_deregistered":true,"queue_deleted":true,"queue_disabled":true,"service_linked_role_deleted":false,"service_linked_role_deletion_task_id":"task/aws-service-role/batch.amazonaws.com/AWSServiceRoleForBatch/12c6d838-ac1c-417b-a52c-32dbd2aa8f96"},"verdict":"failed"}
