{"account_id":"892077329800","failure_reason":"QualificationError: qualification failed closed","gates":{"all_children_one_attempt":false,"all_children_succeeded":false,"array_size_exact":false,"child_indices_exact":false,"compute_environment_valid":true,"exact_teardown":true,"job_queue_valid":true,"no_provider_errors":true,"no_retries":true,"no_scientific_action":true,"preflight_exact":true},"identity_arn":"arn:aws:iam::892077329800:root","input_lock_sha256":null,"mutations":[{"duration_ms":1343,"operation":"create_service_linked_role","return_code":0,"stderr_sha256":"e3b0c44298fc1c149afbf4c8996fb92427ae41e4649b934ca495991b7852b855","stdout_sha256":"ac6a11d9c4494be22f8a6d49cc9a36a99634794936f42b4611b31ca88303c54d","succeeded":true},{"duration_ms":1134,"operation":"create_execution_role","return_code":0,"stderr_sha256":"e3b0c44298fc1c149afbf4c8996fb92427ae41e4649b934ca495991b7852b855","stdout_sha256":"a41bbb38bb9f31caa02c267c89ae03276e18a80638f887216ca02e22d557fbe0","succeeded":true},{"duration_ms":1088,"operation":"attach_execution_role_policy","return_code":0,"stderr_sha256":"e3b0c44298fc1c149afbf4c8996fb92427ae41e4649b934ca495991b7852b855","stdout_sha256":"e3b0c44298fc1c149afbf4c8996fb92427ae41e4649b934ca495991b7852b855","succeeded":true},{"duration_ms":1221,"operation":"create_compute_environment","return_code":0,"stderr_sha256":"e3b0c44298fc1c149afbf4c8996fb92427ae41e4649b934ca495991b7852b855","stdout_sha256":"754f39fddcc8cce8509b8ec470336ac61bfed0c968b2078c43fc41b2ba9592c9","succeeded":true},{"duration_ms":1067,"operation":"create_job_queue","return_code":0,"stderr_sha256":"e3b0c44298fc1c149afbf4c8996fb92427ae41e4649b934ca495991b7852b855","stdout_sha256":"1649ac89c8001b4da42cb7c42447df6b5979046919189d180a37afc5325dba4d","succeeded":true},{"duration_ms":1159,"operation":"register_job_definition","return_code":0,"stderr_sha256":"e3b0c44298fc1c149afbf4c8996fb92427ae41e4649b934ca495991b7852b855","stdout_sha256":"5d562b462359498b376832ca3318e01cbd294782a8d89ff39b95c781b42bf79c","succeeded":true},{"duration_ms":1065,"operation":"submit_array_job","return_code":0,"stderr_sha256":"e3b0c44298fc1c149afbf4c8996fb92427ae41e4649b934ca495991b7852b855","stdout_sha256":"784cca2b07ea46d61f2c643ac6a804622c498fc910117166058d4a9f3e02e61e","succeeded":true},{"duration_ms":1173,"operation":"cancel_job","return_code":0,"stderr_sha256":"e3b0c44298fc1c149afbf4c8996fb92427ae41e4649b934ca495991b7852b855","stdout_sha256":"e3b0c44298fc1c149afbf4c8996fb92427ae41e4649b934ca495991b7852b855","succeeded":true},{"duration_ms":1162,"operation":"disable_job_queue","return_code":0,"stderr_sha256":"e3b0c44298fc1c149afbf4c8996fb92427ae41e4649b934ca495991b7852b855","stdout_sha256":"1649ac89c8001b4da42cb7c42447df6b5979046919189d180a37afc5325dba4d","succeeded":true},{"duration_ms":1044,"operation":"delete_job_queue","return_code":0,"stderr_sha256":"e3b0c44298fc1c149afbf4c8996fb92427ae41e4649b934ca495991b7852b855","stdout_sha256":"e3b0c44298fc1c149afbf4c8996fb92427ae41e4649b934ca495991b7852b855","succeeded":true},{"duration_ms":1266,"operation":"disable_compute_environment","return_code":0,"stderr_sha256":"e3b0c44298fc1c149afbf4c8996fb92427ae41e4649b934ca495991b7852b855","stdout_sha256":"754f39fddcc8cce8509b8ec470336ac61bfed0c968b2078c43fc41b2ba9592c9","succeeded":true},{"duration_ms":1053,"operation":"delete_compute_environment","return_code":0,"stderr_sha256":"e3b0c44298fc1c149afbf4c8996fb92427ae41e4649b934ca495991b7852b855","stdout_sha256":"e3b0c44298fc1c149afbf4c8996fb92427ae41e4649b934ca495991b7852b855","succeeded":true},{"duration_ms":1137,"operation":"deregister_job_definition","return_code":0,"stderr_sha256":"e3b0c44298fc1c149afbf4c8996fb92427ae41e4649b934ca495991b7852b855","stdout_sha256":"e3b0c44298fc1c149afbf4c8996fb92427ae41e4649b934ca495991b7852b855","succeeded":true},{"duration_ms":1226,"operation":"detach_execution_role_policy","return_code":0,"stderr_sha256":"e3b0c44298fc1c149afbf4c8996fb92427ae41e4649b934ca495991b7852b855","stdout_sha256":"e3b0c44298fc1c149afbf4c8996fb92427ae41e4649b934ca495991b7852b855","succeeded":true},{"duration_ms":1150,"operation":"delete_execution_role","return_code":0,"stderr_sha256":"e3b0c44298fc1c149afbf4c8996fb92427ae41e4649b934ca495991b7852b855","stdout_sha256":"e3b0c44298fc1c149afbf4c8996fb92427ae41e4649b934ca495991b7852b855","succeeded":true},{"duration_ms":1059,"operation":"delete_service_linked_role","return_code":0,"stderr_sha256":"e3b0c44298fc1c149afbf4c8996fb92427ae41e4649b934ca495991b7852b855","stdout_sha256":"4ae2e24408e696731751cb554dfe548929ef45a1dedca5bee36e2eb098217946","succeeded":true}],"no_scientific_action":true,"observations":{"array_size":0,"child_indices":[],"children":[],"compute_environment_status":"VALID","job_queue_status":"VALID","parent_status":null},"plan_sha256":"31a2f9d594681c7f35aabc83d6e20cdd4fd4ece8ea0ffebc99819afc00f7da9d","preflight":{"account_exact":true,"compute_environment_absent":true,"execution_role_absent":true,"job_definition_absent":true,"job_queue_absent":true,"security_group_exact":true,"service_linked_role_absent":true,"subnet_exact":true,"vpc_exact":true},"provider":"aws","qualification_id":"batch-array-qualification-013","record_kind":"cloud_batch_array_qualification_receipt","region":"us-east-1","residual_resource_ids":[],"resources":{"child_job_ids":[],"compute_environment_arn":"arn:aws:batch:us-east-1:892077329800:compute-environment/pneuma-batch-array-013-ce","compute_environment_name":"pneuma-batch-array-013-ce","execution_role_arn":"arn:aws:iam::892077329800:role/pneuma-batch-array-exec-013","job_definition_arn":"arn:aws:batch:us-east-1:892077329800:job-definition/pneuma-batch-array-013-jd:1","job_definition_revision":1,"job_queue_arn":"arn:aws:batch:us-east-1:892077329800:job-queue/pneuma-batch-array-013-q","job_queue_name":"pneuma-batch-array-013-q","parent_job_id":"2cb10c78-edb9-4943-ae2a-1822d313f1bd","service_linked_role_arn":"arn:aws:iam::892077329800:role/aws-service-role/batch.amazonaws.com/AWSServiceRoleForBatch"},"schema_version":"0.1.0","teardown":{"compute_environment_deleted":true,"compute_environment_disabled":true,"execution_policy_detached":true,"execution_role_deleted":true,"final_resources_absent":true,"job_cancelled_if_needed":true,"job_definition_deregistered":true,"queue_deleted":true,"queue_disabled":true,"service_linked_role_deleted":true,"service_linked_role_deletion_task_id":"task/aws-service-role/batch.amazonaws.com/AWSServiceRoleForBatch/5d529e29-1029-483a-b9b2-1d1bcd8c8439"},"verdict":"failed"}
