{"account_id":"892077329800","failure_reason":"teardown or readback failed closed","gates":{"all_children_one_attempt":true,"all_children_succeeded":true,"array_size_exact":true,"child_indices_exact":true,"compute_environment_valid":true,"exact_teardown":true,"job_queue_valid":true,"no_provider_errors":true,"no_retries":true,"no_scientific_action":true,"preflight_exact":true},"identity_arn":"arn:aws:iam::892077329800:root","input_lock_sha256":null,"mutations":[{"duration_ms":1178,"operation":"create_service_linked_role","return_code":0,"stderr_sha256":"e3b0c44298fc1c149afbf4c8996fb92427ae41e4649b934ca495991b7852b855","stdout_sha256":"450ea387759e024396a8ac2d1a2be1d9f6e3692117b9b1a0b9bfb0f72fe4ae04","succeeded":true},{"duration_ms":1308,"operation":"create_execution_role","return_code":0,"stderr_sha256":"e3b0c44298fc1c149afbf4c8996fb92427ae41e4649b934ca495991b7852b855","stdout_sha256":"edcb827d35919e015aaf0c14c5544c77e82bafc716b11d60463a9da3bbd1f924","succeeded":true},{"duration_ms":1217,"operation":"attach_execution_role_policy","return_code":0,"stderr_sha256":"e3b0c44298fc1c149afbf4c8996fb92427ae41e4649b934ca495991b7852b855","stdout_sha256":"e3b0c44298fc1c149afbf4c8996fb92427ae41e4649b934ca495991b7852b855","succeeded":true},{"duration_ms":1175,"operation":"create_compute_environment","return_code":0,"stderr_sha256":"e3b0c44298fc1c149afbf4c8996fb92427ae41e4649b934ca495991b7852b855","stdout_sha256":"90ad0812e74cb4fede5c7af22d45e8f48622fba0e68e9a7536659266f6cd2244","succeeded":true},{"duration_ms":1076,"operation":"create_job_queue","return_code":0,"stderr_sha256":"e3b0c44298fc1c149afbf4c8996fb92427ae41e4649b934ca495991b7852b855","stdout_sha256":"2681246e7c8baf7f06cc53d2af9ea8617b7b99b5c422935ba3aeee1b2de66e5e","succeeded":true},{"duration_ms":1154,"operation":"register_job_definition","return_code":0,"stderr_sha256":"e3b0c44298fc1c149afbf4c8996fb92427ae41e4649b934ca495991b7852b855","stdout_sha256":"41f0d837ec02c0f88f65ea0a8d6255c6583c96071985a20c5ac140db0053c4c7","succeeded":true},{"duration_ms":1097,"operation":"submit_array_job","return_code":0,"stderr_sha256":"e3b0c44298fc1c149afbf4c8996fb92427ae41e4649b934ca495991b7852b855","stdout_sha256":"52f985014ed093f6e040aea281e358839f2fdd4d14741fbe716a9110498c28e8","succeeded":true},{"duration_ms":1236,"operation":"disable_job_queue","return_code":0,"stderr_sha256":"e3b0c44298fc1c149afbf4c8996fb92427ae41e4649b934ca495991b7852b855","stdout_sha256":"2681246e7c8baf7f06cc53d2af9ea8617b7b99b5c422935ba3aeee1b2de66e5e","succeeded":true},{"duration_ms":1093,"operation":"delete_job_queue","return_code":0,"stderr_sha256":"e3b0c44298fc1c149afbf4c8996fb92427ae41e4649b934ca495991b7852b855","stdout_sha256":"e3b0c44298fc1c149afbf4c8996fb92427ae41e4649b934ca495991b7852b855","succeeded":true},{"duration_ms":1093,"operation":"disable_compute_environment","return_code":0,"stderr_sha256":"e3b0c44298fc1c149afbf4c8996fb92427ae41e4649b934ca495991b7852b855","stdout_sha256":"90ad0812e74cb4fede5c7af22d45e8f48622fba0e68e9a7536659266f6cd2244","succeeded":true},{"duration_ms":1057,"operation":"delete_compute_environment","return_code":0,"stderr_sha256":"e3b0c44298fc1c149afbf4c8996fb92427ae41e4649b934ca495991b7852b855","stdout_sha256":"e3b0c44298fc1c149afbf4c8996fb92427ae41e4649b934ca495991b7852b855","succeeded":true},{"duration_ms":1079,"operation":"deregister_job_definition","return_code":0,"stderr_sha256":"e3b0c44298fc1c149afbf4c8996fb92427ae41e4649b934ca495991b7852b855","stdout_sha256":"e3b0c44298fc1c149afbf4c8996fb92427ae41e4649b934ca495991b7852b855","succeeded":true},{"duration_ms":1291,"operation":"detach_execution_role_policy","return_code":0,"stderr_sha256":"e3b0c44298fc1c149afbf4c8996fb92427ae41e4649b934ca495991b7852b855","stdout_sha256":"e3b0c44298fc1c149afbf4c8996fb92427ae41e4649b934ca495991b7852b855","succeeded":true},{"duration_ms":1310,"operation":"delete_execution_role","return_code":0,"stderr_sha256":"e3b0c44298fc1c149afbf4c8996fb92427ae41e4649b934ca495991b7852b855","stdout_sha256":"e3b0c44298fc1c149afbf4c8996fb92427ae41e4649b934ca495991b7852b855","succeeded":true},{"duration_ms":1226,"operation":"delete_service_linked_role","return_code":0,"stderr_sha256":"e3b0c44298fc1c149afbf4c8996fb92427ae41e4649b934ca495991b7852b855","stdout_sha256":"11a0052cb075746c016f1de5d701d2a3c6e2d6d447780f8e189b68cc32d8026f","succeeded":true}],"no_scientific_action":true,"observations":{"array_size":3,"child_indices":[0,1,2],"children":[{"attempt_count":1,"index":0,"job_id":"bfa17956-3b27-462b-8cad-a051593bdf95:0","status":"SUCCEEDED"},{"attempt_count":1,"index":1,"job_id":"bfa17956-3b27-462b-8cad-a051593bdf95:1","status":"SUCCEEDED"},{"attempt_count":1,"index":2,"job_id":"bfa17956-3b27-462b-8cad-a051593bdf95:2","status":"SUCCEEDED"}],"compute_environment_status":"VALID","job_queue_status":"VALID","parent_status":"SUCCEEDED"},"plan_sha256":"920668ddd6b896a9906c1fe348881d696289bd598d2877e5c2013f579f711f79","preflight":{"account_exact":true,"compute_environment_absent":true,"execution_role_absent":true,"job_definition_absent":true,"job_queue_absent":true,"security_group_exact":true,"service_linked_role_absent":true,"subnet_exact":true,"vpc_exact":true},"provider":"aws","qualification_id":"batch-array-qualification-014","record_kind":"cloud_batch_array_qualification_receipt","region":"us-east-1","residual_resource_ids":[],"resources":{"child_job_ids":["bfa17956-3b27-462b-8cad-a051593bdf95:0","bfa17956-3b27-462b-8cad-a051593bdf95:1","bfa17956-3b27-462b-8cad-a051593bdf95:2"],"compute_environment_arn":"arn:aws:batch:us-east-1:892077329800:compute-environment/pneuma-batch-array-014-ce","compute_environment_name":"pneuma-batch-array-014-ce","execution_role_arn":"arn:aws:iam::892077329800:role/pneuma-batch-array-exec-014","job_definition_arn":"arn:aws:batch:us-east-1:892077329800:job-definition/pneuma-batch-array-014-jd:1","job_definition_revision":1,"job_queue_arn":"arn:aws:batch:us-east-1:892077329800:job-queue/pneuma-batch-array-014-q","job_queue_name":"pneuma-batch-array-014-q","parent_job_id":"bfa17956-3b27-462b-8cad-a051593bdf95","service_linked_role_arn":"arn:aws:iam::892077329800:role/aws-service-role/batch.amazonaws.com/AWSServiceRoleForBatch"},"schema_version":"0.1.0","teardown":{"compute_environment_deleted":true,"compute_environment_disabled":true,"execution_policy_detached":true,"execution_role_deleted":true,"final_resources_absent":true,"job_cancelled_if_needed":true,"job_definition_deregistered":true,"queue_deleted":true,"queue_disabled":true,"service_linked_role_deleted":true,"service_linked_role_deletion_task_id":"task/aws-service-role/batch.amazonaws.com/AWSServiceRoleForBatch/93dc84f5-af03-4335-a1e0-cac8b06ef85e"},"verdict":"passed"}
